{"artifacts":[],"candidate_id":"89b66a65-19a8-508a-ae1f-0db159139a6c","evaluator_version":"0.1.0","finished_at":"2025-01-01T00:00:00.004Z","level":"L0","metrics":{"exit_code":0},"primary_reason":"PASS","schema_version":1,"secondary_reasons":[],"started_at":"2025-01-01T00:00:00.003Z","status":"pass","task_id":"pydata__xarray-2905"}
