{"artifacts":[],"candidate_id":"c438a68f-8533-557f-96bd-9f13cdf43fdf","evaluator_version":"0.1.0","finished_at":"2025-01-01T00:00:00.008Z","level":"L3","metrics":{"conformant":true,"executed_commands":1,"findings":0,"findings_by_code":{},"modified_files":1,"policy_name":"swe_bench_verified_headline"},"primary_reason":"PASS","schema_version":1,"secondary_reasons":[],"started_at":"2025-01-01T00:00:00.007Z","status":"pass","task_id":"astropy__astropy-12907"}
