{"artifacts":[],"candidate_id":"957569be-5b08-5336-9d7c-3096f1849b87","evaluator_version":"0.1.0","finished_at":"2025-01-01T00:00:00.006Z","level":"L1","metrics":{"l0_metrics":{"exit_code":4,"harness_error":true},"l1_metrics":{"exit_code":4,"harness_error":true},"rerun_agreement":true},"primary_reason":"L1_HARNESS_ERROR","schema_version":1,"secondary_reasons":["L0_OFFICIAL_INVALID"],"started_at":"2025-01-01T00:00:00.005Z","status":"invalid","task_id":"matplotlib__matplotlib-22719"}
