{"artifacts":[],"candidate_id":"f11c1dd9-0c56-5880-b4b3-cfdfbea13df1","evaluator_version":"0.1.0","finished_at":"2025-01-01T00:00:00.004Z","level":"L0","metrics":{"exit_code":4},"primary_reason":"L0_OFFICIAL_FAIL","schema_version":1,"secondary_reasons":[],"started_at":"2025-01-01T00:00:00.003Z","status":"fail","task_id":"pytest-dev__pytest-10051"}
