{"artifacts":[],"candidate_id":"44210d30-d785-5d56-a491-f6518941a82e","evaluator_version":"0.1.0","finished_at":"2025-01-01T00:00:00.004Z","level":"L0","metrics":{"exit_code":1,"harness_error":true},"primary_reason":"L0_OFFICIAL_INVALID","schema_version":1,"secondary_reasons":[],"started_at":"2025-01-01T00:00:00.003Z","status":"invalid","task_id":"jlowin__fastmcp-279"}
