{"artifacts":[],"candidate_id":"355da569-9192-536d-a521-a0023b919bfb","evaluator_version":"0.1.0","finished_at":"2025-01-01T00:00:00.004Z","level":"L0","metrics":{"exit_code":1,"harness_error":true},"primary_reason":"L0_OFFICIAL_INVALID","schema_version":1,"secondary_reasons":[],"started_at":"2025-01-01T00:00:00.003Z","status":"invalid","task_id":"sympy__sympy-22914"}
