{"artifacts":[],"candidate_id":"28bac07d-9ede-5b1b-a50d-060a4f3852dd","evaluator_version":"0.1.0","finished_at":"2025-01-01T00:00:00.009Z","level":"L3","metrics":{"conformant":false,"executed_commands":1,"findings":1,"findings_by_code":{"PV_ENV_NONDETERMINISTIC":1},"modified_files":2,"policy_name":"swe_bench_verified_headline"},"primary_reason":"PV_ENV_NONDETERMINISTIC","schema_version":1,"secondary_reasons":[],"started_at":"2025-01-01T00:00:00.007Z","status":"fail","task_id":"astropy__astropy-7671"}
