{"artifacts":[],"candidate_id":"92bc0f89-b721-5883-b94c-6c97f671239a","evaluator_version":"0.1.0","finished_at":"2025-01-01T00:00:00.010Z","level":"L3","metrics":{"conformant":false,"executed_commands":1,"findings":2,"findings_by_code":{"PV_EDIT_SCOPE":1,"PV_ENV_NONDETERMINISTIC":1},"modified_files":1,"policy_name":"default_verified_policy"},"primary_reason":"PV_EDIT_SCOPE","schema_version":1,"secondary_reasons":["PV_ENV_NONDETERMINISTIC"],"started_at":"2025-01-01T00:00:00.007Z","status":"fail","task_id":"sympy__sympy-16886"}
