{"artifacts":[],"candidate_id":"8ae14dc4-2502-56c5-afc3-2821c1a8362e","evaluator_version":"0.1.0","finished_at":"2025-01-01T00:00:00.008Z","level":"L2","metrics":{"per_validator":[{"metrics":{"failed":1,"passed":0,"total":1},"primary_reason":"L2_AUG_TESTS_FAIL","validator":"augmented_unit_tests","verdict":"fail"},{"metrics":{"failed":1,"passed":0,"total":1},"primary_reason":"L2_REGRESSION_FAIL","validator":"targeted_regression","verdict":"fail"}],"validators_not_applicable":0,"validators_ran":2,"validators_total":2},"primary_reason":"L2_AUG_TESTS_FAIL","schema_version":1,"secondary_reasons":["L2_REGRESSION_FAIL"],"started_at":"2025-01-01T00:00:00.007Z","status":"fail","task_id":"django__django-9296"}
