{"artifacts":[],"candidate_id":"107ab12e-0ad5-5d40-9a1a-e800cdf07855","evaluator_version":"0.1.0","finished_at":"2025-01-01T00:00:00.004Z","level":"L0","metrics":{"exit_code":1},"primary_reason":"L0_OFFICIAL_FAIL","schema_version":1,"secondary_reasons":[],"started_at":"2025-01-01T00:00:00.003Z","status":"fail","task_id":"django__django-11066"}
