{"artifacts":[],"candidate_id":"4c8c378e-267f-5dca-9f39-9f119ab4fb6f","evaluator_version":"0.1.0","finished_at":"2025-01-01T00:00:00.006Z","level":"L1","metrics":{"l0_metrics":{"exit_code":1,"harness_error":true},"l1_metrics":{"exit_code":1,"harness_error":true},"rerun_agreement":true},"primary_reason":"L1_HARNESS_ERROR","schema_version":1,"secondary_reasons":["L0_OFFICIAL_INVALID"],"started_at":"2025-01-01T00:00:00.005Z","status":"invalid","task_id":"sympy__sympy-23262"}
