{"artifacts":[],"candidate_id":"b7c97bc1-9d66-5d82-b491-d04faea4b508","evaluator_version":"0.1.0","finished_at":"2025-01-01T00:00:00.004Z","level":"L0","metrics":{"exit_code":0},"primary_reason":"PASS","schema_version":1,"secondary_reasons":[],"started_at":"2025-01-01T00:00:00.003Z","status":"pass","task_id":"pydata__xarray-2905"}
