{"artifacts":[],"candidate_id":"de474174-01fc-59d3-8dca-00195079797b","evaluator_version":"0.1.0","finished_at":"2025-01-01T00:00:00.010Z","level":"L4","metrics":{"duration_ms":1,"obligation_id":"obl.rust_swe_bench.clap_rs.clap_1624.paper_semantics_counterexample","pass_criterion":"L4_OBLIGATION_MET","property_type":"state_machine_safety"},"primary_reason":"L4_OBLIGATION_UNMET","schema_version":1,"secondary_reasons":[],"started_at":"2025-01-01T00:00:00.009Z","status":"fail","task_id":"clap-rs__clap_1624"}
