{"artifacts":[],"candidate_id":"5742c5d5-1fa6-53c1-ab98-086506c3c99a","evaluator_version":"0.1.0","finished_at":"2025-01-01T00:00:00.006Z","level":"L1","metrics":{"l0_metrics":{"exit_code":101},"l1_metrics":{"exit_code":101},"rerun_agreement":true},"primary_reason":"L1_HARNESS_ERROR","schema_version":1,"secondary_reasons":["L0_OFFICIAL_FAIL"],"started_at":"2025-01-01T00:00:00.005Z","status":"fail","task_id":"clap-rs__clap_2093"}
