{"artifacts":[],"candidate_id":"5c7934e7-2097-59a8-a55f-8057f8420740","evaluator_version":"0.1.0","finished_at":"2025-01-01T00:00:00.010Z","level":"L4","metrics":{"duration_ms":1,"obligation_id":"obl.rust_swe_bench.clap_rs.clap_1972.version_line_terminator","pass_criterion":"L4_OBLIGATION_MET","property_type":"parser_serializer_consistency"},"primary_reason":"L4_OBLIGATION_MET","schema_version":1,"secondary_reasons":[],"started_at":"2025-01-01T00:00:00.009Z","status":"pass","task_id":"clap-rs__clap_1972"}
