{"artifacts":[],"candidate_id":"0f3ee971-6b5f-5517-9f4d-5aed74ffce98","evaluator_version":"0.1.0","finished_at":"2025-01-01T00:00:00.006Z","level":"L1","metrics":{"l0_metrics":{"timed_out":true},"reason":"smart_rust_reuse_nonpass","rerun_agreement":true,"rerun_skipped":true},"primary_reason":"L1_HARNESS_ERROR","schema_version":1,"secondary_reasons":["L0_OFFICIAL_TIMEOUT","L1_REUSED_FROM_L0"],"started_at":"2025-01-01T00:00:00.005Z","status":"invalid","task_id":"BurntSushi__ripgrep_454"}
