{"artifacts":[],"candidate_id":"1d5d24df-5c6e-5b20-9648-f8f141e59bb8","evaluator_version":"0.1.0","finished_at":"2025-01-01T00:00:00.004Z","level":"L0","metrics":{"exit_code":4},"primary_reason":"L0_OFFICIAL_FAIL","schema_version":1,"secondary_reasons":[],"started_at":"2025-01-01T00:00:00.003Z","status":"fail","task_id":"feature-engine__feature_engine-856"}
