{"artifacts":[],"candidate_id":"6f8beb02-128a-56e0-9da2-70f74867257d","evaluator_version":"0.1.0","finished_at":"2025-01-01T00:00:00.006Z","level":"L1","metrics":{"l0_metrics":{"exit_code":101},"reason":"smart_rust_reuse_nonpass","rerun_agreement":true,"rerun_skipped":true},"primary_reason":"L1_HARNESS_ERROR","schema_version":1,"secondary_reasons":["L0_OFFICIAL_FAIL","L1_REUSED_FROM_L0"],"started_at":"2025-01-01T00:00:00.005Z","status":"fail","task_id":"clap-rs__clap_1710"}
