{"artifacts":[],"candidate_id":"aeb947e8-19b6-57ee-9a92-8f67eddbc15e","evaluator_version":"0.1.0","finished_at":"2025-01-01T00:00:00.008Z","level":"L3","metrics":{"conformant":true,"executed_commands":1,"findings":0,"findings_by_code":{},"modified_files":2,"policy_name":"swe_bench_verified_headline"},"primary_reason":"PASS","schema_version":1,"secondary_reasons":[],"started_at":"2025-01-01T00:00:00.007Z","status":"pass","task_id":"Pyomo__pyomo-3588"}
