{"artifacts":[],"candidate_id":"aa9a1603-cdb5-583c-b097-d70167f89353","evaluator_version":"0.1.0","finished_at":"2025-01-01T00:00:00.006Z","level":"L1","metrics":{"l0_metrics":{"exit_code":1},"l1_metrics":{"exit_code":1},"rerun_agreement":true},"primary_reason":"L1_HARNESS_ERROR","schema_version":1,"secondary_reasons":["L0_OFFICIAL_FAIL"],"started_at":"2025-01-01T00:00:00.005Z","status":"fail","task_id":"astropy__astropy-14309"}
